{
  "schema_version": "1.0.0",
  "generated_on": "2026-07-13",
  "source": {
    "title": "American Big English 2 Student's Book",
    "edition": "Second Edition",
    "authors": [
      "Mario Herrera",
      "Christopher Sol Cruz"
    ],
    "page_count_pdf": 139,
    "purpose": "Private curriculum extraction for an original, unofficial interactive practice website.",
    "copyright_boundary": "This package records syllabus facts, short target language patterns, vocabulary lists, and pedagogical structure. It intentionally excludes scanned pages, publisher images, audio, songs, long stories, and substantial verbatim exercises."
  },
  "course": {
    "id": "english-adventure-2",
    "working_title": "English Adventure 2",
    "description": "An original interactive practice companion aligned to the Big English 2 learning progression.",
    "target_age": 9,
    "target_level": "Primary beginner ESL; approximately pre-A1 to early A1",
    "learner_ui_language": "English",
    "support_language": "Persian",
    "delivery": "Static browser application deployed through GitHub Pages",
    "sequence": [
      "welcome",
      "unit-1",
      "unit-2",
      "unit-3",
      "checkpoint-1-3",
      "unit-4",
      "unit-5",
      "unit-6",
      "checkpoint-4-6",
      "unit-7",
      "unit-8",
      "unit-9",
      "checkpoint-7-9",
      "starters-practice"
    ],
    "unit_lesson_sequence": [
      "introduction",
      "vocabulary-discovery",
      "vocabulary-practice",
      "grammar-discovery",
      "grammar-practice",
      "listening",
      "reading-story",
      "reading-comprehension",
      "speaking",
      "guided-writing",
      "dictation",
      "phonics",
      "content-connection",
      "culture-connection",
      "values",
      "mixed-review",
      "unit-challenge",
      "mastery-report"
    ]
  },
  "units": [
    {
      "id": "welcome",
      "number": 0,
      "type": "welcome",
      "title": "Welcome to Class!",
      "printed_pages": "a-d",
      "pdf_pages": [
        5,
        8
      ],
      "theme": "Classroom objects, family members, everyday actions, and review language.",
      "vocabulary": [
        {
          "group": "classroom_objects",
          "items": [
            "backpack",
            "book",
            "chair",
            "desk",
            "floor",
            "marker",
            "notebook",
            "pen",
            "pencil",
            "pencil case",
            "shelf",
            "table"
          ]
        },
        {
          "group": "location_prepositions",
          "items": [
            "on",
            "under"
          ]
        },
        {
          "group": "daily_actions",
          "items": [
            "brush your teeth",
            "comb your hair",
            "drink",
            "dry the dishes",
            "eat",
            "make lunch",
            "play a game",
            "read",
            "ride a bike",
            "sleep",
            "take a bath",
            "talk on the phone"
          ]
        },
        {
          "group": "family_and_people",
          "items": [
            "brother",
            "dad",
            "grandma",
            "grandpa",
            "mom",
            "sister"
          ]
        }
      ],
      "grammar": [
        {
          "target": "singular location questions",
          "patterns": [
            "Where's my notebook?",
            "It's on the shelf."
          ]
        },
        {
          "target": "plural location questions",
          "patterns": [
            "Where are the pens?",
            "They're on the floor."
          ]
        },
        {
          "target": "present continuous review",
          "patterns": [
            "What are you doing?",
            "I'm brushing my teeth.",
            "What's he doing?",
            "He's reading."
          ]
        },
        {
          "target": "have/has yes-no questions",
          "patterns": [
            "Does she have a phone?",
            "Yes, she does.",
            "No, she doesn't."
          ]
        }
      ],
      "skill_focus": {
        "listening": [
          "identify people, actions, and locations",
          "follow short classroom descriptions"
        ],
        "speaking": [
          "ask and answer about current actions",
          "ask where classroom objects are"
        ],
        "reading": [
          "match short statements to pictures",
          "judge simple true/false statements"
        ],
        "writing": [
          "label people and objects",
          "complete short location and action sentences"
        ],
        "dictation": [
          "classroom object words",
          "short on/under sentences",
          "daily action phrases"
        ]
      },
      "outcomes": [
        "Name common classroom objects and close family members.",
        "Use on and under to describe location.",
        "Ask and answer about actions happening now.",
        "Use does ... have? with short answers.",
        "Distinguish singular and plural location questions."
      ],
      "recommended_activity_types": [
        "picture-word-match",
        "true-false",
        "acting-guess",
        "listen-and-select",
        "label-picture",
        "location-drag-drop",
        "dictation",
        "role-play"
      ],
      "source_sections": [
        "Welcome Unit pages a-d"
      ],
      "content_counts": {
        "vocabulary_activities": 12,
        "grammar_activities": 8,
        "listening_activities": 4,
        "reading_passages": 3,
        "speaking_prompts": 5,
        "writing_activities": 5,
        "dictation_activities": 6,
        "phonics_activities": 0,
        "clil_activities": 0,
        "culture_activities": 0,
        "values_activities": 0,
        "mixed_unit_challenges": 1
      }
    },
    {
      "id": "unit-1",
      "number": 1,
      "type": "unit",
      "title": "In My Classroom",
      "printed_pages": "4-15",
      "pdf_pages": [
        9,
        20
      ],
      "theme": "Classroom activities and describing what people are doing.",
      "vocabulary": [
        {
          "group": "classroom_activities",
          "items": [
            "coloring a picture",
            "counting",
            "cutting paper",
            "gluing shapes",
            "listening to a story",
            "playing a game",
            "using the computer",
            "watching a movie",
            "writing her name"
          ]
        },
        {
          "group": "math_language",
          "items": [
            "plus",
            "minus",
            "equals"
          ]
        },
        {
          "group": "numbers_extension",
          "items": [
            "eleven",
            "twelve",
            "thirteen",
            "fourteen",
            "fifteen",
            "sixteen",
            "seventeen",
            "eighteen",
            "nineteen",
            "twenty",
            "thirty",
            "forty",
            "fifty",
            "sixty",
            "seventy",
            "eighty",
            "ninety",
            "a hundred"
          ]
        }
      ],
      "grammar": [
        {
          "target": "present continuous with be + -ing",
          "patterns": [
            "What's he doing?",
            "He's reading a book.",
            "What are they doing?",
            "They're gluing pictures."
          ]
        },
        {
          "target": "there is/there are with numbers",
          "patterns": [
            "How many pictures are there?",
            "There's one picture.",
            "There are three books."
          ]
        }
      ],
      "story_theme": "Classmates identify different children who share the same first name by observing their classroom activities.",
      "content_connection": {
        "subject": "Math",
        "title": "Arithmetic",
        "words": [
          "plus",
          "minus",
          "equals"
        ],
        "concepts": [
          "read and solve simple addition and subtraction statements",
          "use English number words up to 100"
        ]
      },
      "culture_connection": {
        "title": "Classes outside the classroom",
        "places": [
          "Turkey",
          "France",
          "United States",
          "Bangladesh"
        ],
        "words": [
          "forest",
          "garden",
          "mountains",
          "boat"
        ],
        "concepts": [
          "school activities can happen in forests, gardens, mountains, and boats"
        ]
      },
      "phonics": {
        "graphemes": [
          "th"
        ],
        "contrasts": [
          "voiced th",
          "unvoiced th"
        ],
        "examples": [
          "that",
          "the",
          "then",
          "this",
          "with",
          "bath",
          "both",
          "math",
          "mouth",
          "path",
          "thin"
        ]
      },
      "values": {
        "title": "Take turns",
        "language": [
          "May I use the markers?",
          "It's your turn.",
          "Thanks."
        ],
        "project": "Create a simple puppet and practise a turn-taking role-play."
      },
      "outcomes": [
        "Use words for classroom activities.",
        "Use there is and there are to describe a classroom.",
        "Ask and answer about what people are doing in the classroom."
      ],
      "skill_focus": {
        "listening": [
          "identify classroom activities",
          "listen for quantities and actions"
        ],
        "speaking": [
          "describe picture actions",
          "ask and answer how many"
        ],
        "reading": [
          "read a short classroom story",
          "identify characters by actions"
        ],
        "writing": [
          "complete -ing forms",
          "write there is/there are sentences"
        ],
        "dictation": [